{
  "schema_version": "0.2.0",
  "created_at": "2026-07-19T12:00:00.000Z",
  "world": {
    "id": "frostwatch-vale",
    "input_spec": {
      "path": "worlds/frostwatch-vale.world.json",
      "sha256": "41547ed2c93bb72266c40a37ec0d6a85a391b97423ad78339b1144d1274216cb"
    },
    "seed": "mapsoo-frostwatch-001"
  },
  "provider": {
    "id": "procedural-terrain-v2",
    "version": "0.2.0",
    "execution": "local",
    "output_provenance": "procedural"
  },
  "model": null,
  "workflow": {
    "id": "mapsoo-playable-terrain-pack",
    "version": "0.2.0",
    "definition_sha256": null
  },
  "transformations": [
    {
      "id": "seeded-map-layout",
      "version": "0.1.0"
    },
    {
      "id": "cardinal-terrain-projection",
      "version": "0.2.0"
    },
    {
      "id": "procedural-pixel-atlas",
      "version": "0.2.0"
    },
    {
      "id": "png-rgba-export",
      "version": "0.1.0"
    }
  ],
  "ai_disclosure": {
    "contains_generative_ai": false,
    "human_curated": false,
    "statement": null
  },
  "licensing": {
    "output": {
      "id": "CC0-1.0",
      "notice_path": "license-assets.md"
    },
    "provider_terms": null
  },
  "sources": []
}
